{
  "apiVersion": "ahra.dev/v1alpha1",
  "kind": "PlanIR",
  "metadata": {
    "digest": "sha256:10dc2a58a9bea34fc3a807de8bfe7e143a0779a0b31d62522ce0235900050d20",
    "planId": "PLAN-96089b34263f0645",
    "version": 1
  },
  "spec": {
    "claimGraphDigest": "sha256:6666666666666666666666666666666666666666666666666666666666666666",
    "compilerVersion": "ahra-plan-compiler/0.1",
    "edges": [
      {
        "sourceNodeRef": "NODE-write-artifact",
        "targetNodeRef": "NODE-goal-verification"
      }
    ],
    "goalDigest": "sha256:5555555555555555555555555555555555555555555555555555555555555555",
    "goalRef": "GOAL-M1-GENERIC-SMOKE",
    "nodes": [
      {
        "budget": {
          "maxCostUsd": 0.0,
          "maxModelCalls": 2,
          "maxSpawnedNodes": 0,
          "maxToolCalls": 1,
          "maxWallSeconds": 180
        },
        "canonicalOrder": 0,
        "capabilityGrants": [
          {
            "capability": "filesystem.write",
            "grantDigest": "sha256:aff3f2bb128762ccc9b85b1716e56d98db681dbc07c5a168321ebeaa10910b37",
            "resources": [
              "outputs/summary.txt"
            ]
          }
        ],
        "claimRefs": [
          "CLM-WRITE-ARTIFACT"
        ],
        "dependsOn": [],
        "expectedOutputs": [
          {
            "artifactRequired": true,
            "consumerNodeRefs": [
              "NODE-goal-verification"
            ],
            "name": "deterministic-artifact",
            "schemaRef": "schema/m1-deterministic-artifact@sha256:8888888888888888888888888888888888888888888888888888888888888888"
          }
        ],
        "gateDigests": [
          "sha256:3333333333333333333333333333333333333333333333333333333333333333"
        ],
        "gateRefs": [
          "GATE-write-artifact"
        ],
        "id": "NODE-write-artifact",
        "inputRefs": [
          "input/m1-generic-smoke@sha256:7777777777777777777777777777777777777777777777777777777777777777"
        ],
        "nodeType": "bounded_task",
        "objective": "Write the deterministic goal artifact inside the governed workspace.",
        "retryPolicy": {
          "idempotencyKeyRequired": true,
          "maxAttempts": 1,
          "retryableFailureClasses": []
        },
        "runtimeDigest": "sha256:eeeeeeeeeeeeeeeeeeeeeeeeeeeeeeeeeeeeeeeeeeeeeeeeeeeeeeeeeeeeeeee",
        "runtimeRef": "runtime/local-goal@sha256:eeeeeeeeeeeeeeeeeeeeeeeeeeeeeeeeeeeeeeeeeeeeeeeeeeeeeeeeeeeeeeee",
        "sideEffect": "idempotent",
        "terminalGoalVerification": false,
        "timeoutSeconds": 180
      },
      {
        "budget": {
          "maxCostUsd": 0.0,
          "maxModelCalls": 1,
          "maxSpawnedNodes": 0,
          "maxToolCalls": 1,
          "maxWallSeconds": 30
        },
        "canonicalOrder": 1,
        "capabilityGrants": [],
        "claimRefs": [
          "CLM-GOAL-COMPLETE",
          "CLM-WRITE-ARTIFACT"
        ],
        "dependsOn": [
          "NODE-write-artifact"
        ],
        "expectedOutputs": [],
        "gateDigests": [
          "sha256:4444444444444444444444444444444444444444444444444444444444444444"
        ],
        "gateRefs": [
          "GATE-goal-complete"
        ],
        "id": "NODE-goal-verification",
        "inputRefs": [
          "NODE-write-artifact"
        ],
        "nodeType": "goal_verification",
        "objective": "Verify the deterministic GoalExecution completion claim.",
        "retryPolicy": {
          "idempotencyKeyRequired": false,
          "maxAttempts": 1,
          "retryableFailureClasses": []
        },
        "runtimeDigest": "sha256:eeeeeeeeeeeeeeeeeeeeeeeeeeeeeeeeeeeeeeeeeeeeeeeeeeeeeeeeeeeeeeee",
        "runtimeRef": "runtime/local-goal@sha256:eeeeeeeeeeeeeeeeeeeeeeeeeeeeeeeeeeeeeeeeeeeeeeeeeeeeeeeeeeeeeeee",
        "sideEffect": "idempotent",
        "terminalGoalVerification": true,
        "timeoutSeconds": 30
      }
    ]
  }
}
