{
  "apiVersion": "ahra.dev/v1alpha1",
  "kind": "PlanIR",
  "metadata": {
    "digest": "sha256:cd608800384d67e049af68721385db269b9aa3fabe32df4ef4876760995dded4",
    "planId": "PLAN-8e4b6f1362c109fc",
    "version": 1
  },
  "spec": {
    "claimGraphDigest": "sha256:6666666666666666666666666666666666666666666666666666666666666666",
    "compilerVersion": "ahra-plan-compiler/0.1",
    "edges": [
      {
        "sourceNodeRef": "NODE-write-artifact",
        "targetNodeRef": "NODE-goal-verification"
      }
    ],
    "goalDigest": "sha256:5555555555555555555555555555555555555555555555555555555555555555",
    "goalRef": "GOAL-M1-GENERIC-SMOKE",
    "nodes": [
      {
        "budget": {
          "maxCostUsd": 0.0,
          "maxModelCalls": 1,
          "maxSpawnedNodes": 0,
          "maxToolCalls": 1,
          "maxWallSeconds": 60
        },
        "canonicalOrder": 0,
        "capabilityGrants": [],
        "claimRefs": [
          "CLM-WRITE-ARTIFACT"
        ],
        "dependsOn": [],
        "expectedOutputs": [
          {
            "artifactRequired": true,
            "consumerNodeRefs": [
              "NODE-goal-verification"
            ],
            "deliveryRole": "artifact",
            "name": "deterministic-artifact",
            "schemaRef": "planner-output-contracts"
          }
        ],
        "gateDigests": [
          "sha256:3333333333333333333333333333333333333333333333333333333333333333"
        ],
        "gateRefs": [
          "GATE-write-artifact"
        ],
        "id": "NODE-write-artifact",
        "inputRefs": [
          "GOAL-M1-GENERIC-SMOKE",
          "profile/m1-real-planner@sha256:ffffffffffffffffffffffffffffffffffffffffffffffffffffffffffffffff"
        ],
        "nodeType": "bounded_task",
        "objective": "Produce the bounded artifact required for the generic smoke goal under the write-artifact gate.",
        "retryPolicy": {
          "idempotencyKeyRequired": true,
          "maxAttempts": 1,
          "retryableFailureClasses": []
        },
        "runtimeDigest": "sha256:eeeeeeeeeeeeeeeeeeeeeeeeeeeeeeeeeeeeeeeeeeeeeeeeeeeeeeeeeeeeeeee",
        "runtimeRef": "runtime/local-goal@sha256:eeeeeeeeeeeeeeeeeeeeeeeeeeeeeeeeeeeeeeeeeeeeeeeeeeeeeeeeeeeeeeee",
        "sideEffect": "idempotent",
        "terminalGoalVerification": false,
        "timeoutSeconds": 60
      },
      {
        "budget": {
          "maxCostUsd": 0.0,
          "maxModelCalls": 1,
          "maxSpawnedNodes": 0,
          "maxToolCalls": 1,
          "maxWallSeconds": 60
        },
        "canonicalOrder": 1,
        "capabilityGrants": [],
        "claimRefs": [
          "CLM-GOAL-COMPLETE",
          "CLM-WRITE-ARTIFACT"
        ],
        "dependsOn": [
          "NODE-write-artifact"
        ],
        "expectedOutputs": [],
        "gateDigests": [
          "sha256:4444444444444444444444444444444444444444444444444444444444444444"
        ],
        "gateRefs": [
          "GATE-goal-complete"
        ],
        "id": "NODE-goal-verification",
        "inputRefs": [
          "NODE-write-artifact"
        ],
        "nodeType": "goal_verification",
        "objective": "Verify that the write-artifact claim satisfies the generic smoke goal completion claim using the supplied goal-complete gate.",
        "retryPolicy": {
          "idempotencyKeyRequired": false,
          "maxAttempts": 1,
          "retryableFailureClasses": []
        },
        "runtimeDigest": "sha256:eeeeeeeeeeeeeeeeeeeeeeeeeeeeeeeeeeeeeeeeeeeeeeeeeeeeeeeeeeeeeeee",
        "runtimeRef": "runtime/local-goal@sha256:eeeeeeeeeeeeeeeeeeeeeeeeeeeeeeeeeeeeeeeeeeeeeeeeeeeeeeeeeeeeeeee",
        "sideEffect": "idempotent",
        "terminalGoalVerification": true,
        "timeoutSeconds": 60
      }
    ]
  }
}
